{
  "documentId": "PEOPLE-VOLUME-08-TECHNICAL-DOMAIN-SPECIFICATIONS-1.0",
  "version": "1.0",
  "status": "DESIGN_COMPLETE_PENDING_CROSS_VOLUME_FREEZE",
  "canonicalPath": "docs/volumes/volume-08-technical-specifications/VOLUME_08_TECHNICAL_DOMAIN_SPECIFICATIONS.md",
  "contentSha256": "9802b84b47e8e1d202b8691225b6dd9b54a8fb06c92ab985f1c7a59cefd51aa4",
  "globalInvariants": [
    "PEOPLE-INV-001",
    "PEOPLE-INV-002",
    "PEOPLE-INV-003",
    "PEOPLE-INV-004",
    "PEOPLE-INV-005",
    "PEOPLE-INV-006",
    "PEOPLE-INV-007",
    "PEOPLE-INV-008",
    "PEOPLE-INV-009",
    "PEOPLE-INV-010",
    "PEOPLE-INV-011",
    "PEOPLE-INV-012",
    "PEOPLE-INV-013",
    "PEOPLE-INV-014",
    "PEOPLE-INV-015"
  ],
  "domains": [
    {
      "domainId": "DOMAIN-AUTH",
      "name": "Authentication",
      "rulePrefix": "AUTH",
      "rules": [
        "AUTH-RULE-001",
        "AUTH-RULE-002",
        "AUTH-RULE-003",
        "AUTH-RULE-004",
        "AUTH-RULE-005",
        "AUTH-RULE-006",
        "AUTH-RULE-007",
        "AUTH-RULE-008"
      ],
      "invariants": [
        "AUTH-INV-001",
        "AUTH-INV-002",
        "AUTH-INV-003",
        "AUTH-INV-004"
      ]
    },
    {
      "domainId": "DOMAIN-USER",
      "name": "User Access and Approval",
      "rulePrefix": "USER",
      "rules": [
        "USER-RULE-001",
        "USER-RULE-002",
        "USER-RULE-003",
        "USER-RULE-004",
        "USER-RULE-005",
        "USER-RULE-006",
        "USER-RULE-007"
      ],
      "invariants": [
        "USER-INV-001",
        "USER-INV-002",
        "USER-INV-003",
        "USER-INV-004"
      ]
    },
    {
      "domainId": "DOMAIN-AUTHZ",
      "name": "Authorization",
      "rulePrefix": "AUTHZ",
      "rules": [
        "AUTHZ-RULE-001",
        "AUTHZ-RULE-002",
        "AUTHZ-RULE-003",
        "AUTHZ-RULE-004",
        "AUTHZ-RULE-005",
        "AUTHZ-RULE-006",
        "AUTHZ-RULE-007",
        "AUTHZ-RULE-008"
      ],
      "invariants": [
        "AUTHZ-INV-001",
        "AUTHZ-INV-002",
        "AUTHZ-INV-003"
      ]
    },
    {
      "domainId": "DOMAIN-BATCH",
      "name": "Batch",
      "rulePrefix": "BATCH",
      "rules": [
        "BATCH-RULE-001",
        "BATCH-RULE-002",
        "BATCH-RULE-003",
        "BATCH-RULE-004",
        "BATCH-RULE-005",
        "BATCH-RULE-006",
        "BATCH-RULE-007",
        "BATCH-RULE-008"
      ],
      "invariants": [
        "BATCH-INV-001",
        "BATCH-INV-002",
        "BATCH-INV-003",
        "BATCH-INV-004"
      ]
    },
    {
      "domainId": "DOMAIN-PAGE",
      "name": "Page",
      "rulePrefix": "PAGE",
      "rules": [
        "PAGE-RULE-001",
        "PAGE-RULE-002",
        "PAGE-RULE-003",
        "PAGE-RULE-004",
        "PAGE-RULE-005",
        "PAGE-RULE-006",
        "PAGE-RULE-007",
        "PAGE-RULE-008",
        "PAGE-RULE-009"
      ],
      "invariants": [
        "PAGE-INV-001",
        "PAGE-INV-002",
        "PAGE-INV-003",
        "PAGE-INV-004"
      ]
    },
    {
      "domainId": "DOMAIN-IMAGE",
      "name": "Source Image",
      "rulePrefix": "IMAGE",
      "rules": [
        "IMAGE-RULE-001",
        "IMAGE-RULE-002",
        "IMAGE-RULE-003",
        "IMAGE-RULE-004",
        "IMAGE-RULE-005",
        "IMAGE-RULE-006",
        "IMAGE-RULE-007",
        "IMAGE-RULE-008",
        "IMAGE-RULE-009",
        "IMAGE-RULE-010"
      ],
      "invariants": [
        "IMAGE-INV-001",
        "IMAGE-INV-002",
        "IMAGE-INV-003",
        "IMAGE-INV-004"
      ]
    },
    {
      "domainId": "DOMAIN-UPLOAD",
      "name": "Upload",
      "rulePrefix": "UPLOAD",
      "rules": [
        "UPLOAD-RULE-001",
        "UPLOAD-RULE-002",
        "UPLOAD-RULE-003",
        "UPLOAD-RULE-004",
        "UPLOAD-RULE-005",
        "UPLOAD-RULE-006",
        "UPLOAD-RULE-007",
        "UPLOAD-RULE-008"
      ],
      "invariants": [
        "UPLOAD-INV-001",
        "UPLOAD-INV-002",
        "UPLOAD-INV-003"
      ]
    },
    {
      "domainId": "DOMAIN-QUEUE",
      "name": "Shared Work Queue",
      "rulePrefix": "QUEUE",
      "rules": [
        "QUEUE-RULE-001",
        "QUEUE-RULE-002",
        "QUEUE-RULE-003",
        "QUEUE-RULE-004",
        "QUEUE-RULE-005",
        "QUEUE-RULE-006",
        "QUEUE-RULE-007",
        "QUEUE-RULE-008"
      ],
      "invariants": [
        "QUEUE-INV-001",
        "QUEUE-INV-002",
        "QUEUE-INV-003",
        "QUEUE-INV-004"
      ]
    },
    {
      "domainId": "DOMAIN-CLAIM",
      "name": "Claim",
      "rulePrefix": "CLAIM",
      "rules": [
        "CLAIM-RULE-001",
        "CLAIM-RULE-002",
        "CLAIM-RULE-003",
        "CLAIM-RULE-004",
        "CLAIM-RULE-005",
        "CLAIM-RULE-006",
        "CLAIM-RULE-007",
        "CLAIM-RULE-008",
        "CLAIM-RULE-009",
        "CLAIM-RULE-010"
      ],
      "invariants": [
        "CLAIM-INV-001",
        "CLAIM-INV-002",
        "CLAIM-INV-003",
        "CLAIM-INV-004"
      ]
    },
    {
      "domainId": "DOMAIN-DRAFT",
      "name": "Draft",
      "rulePrefix": "DRAFT",
      "rules": [
        "DRAFT-RULE-001",
        "DRAFT-RULE-002",
        "DRAFT-RULE-003",
        "DRAFT-RULE-004",
        "DRAFT-RULE-005",
        "DRAFT-RULE-006",
        "DRAFT-RULE-007",
        "DRAFT-RULE-008"
      ],
      "invariants": [
        "DRAFT-INV-001",
        "DRAFT-INV-002",
        "DRAFT-INV-003"
      ]
    },
    {
      "domainId": "DOMAIN-TRANSCRIPTION",
      "name": "Transcription",
      "rulePrefix": "TRANSCRIPTION",
      "rules": [
        "TRANSCRIPTION-RULE-001",
        "TRANSCRIPTION-RULE-002",
        "TRANSCRIPTION-RULE-003",
        "TRANSCRIPTION-RULE-004",
        "TRANSCRIPTION-RULE-005",
        "TRANSCRIPTION-RULE-006",
        "TRANSCRIPTION-RULE-007",
        "TRANSCRIPTION-RULE-008",
        "TRANSCRIPTION-RULE-009",
        "TRANSCRIPTION-RULE-010",
        "TRANSCRIPTION-RULE-011",
        "TRANSCRIPTION-RULE-012"
      ],
      "invariants": [
        "TRANSCRIPTION-INV-001",
        "TRANSCRIPTION-INV-002",
        "TRANSCRIPTION-INV-003",
        "TRANSCRIPTION-INV-004",
        "TRANSCRIPTION-INV-005"
      ]
    },
    {
      "domainId": "DOMAIN-FIELD",
      "name": "Field Condition",
      "rulePrefix": "FIELD",
      "rules": [
        "FIELD-RULE-001",
        "FIELD-RULE-002",
        "FIELD-RULE-003",
        "FIELD-RULE-004",
        "FIELD-RULE-005",
        "FIELD-RULE-006",
        "FIELD-RULE-007",
        "FIELD-RULE-008"
      ],
      "invariants": [
        "FIELD-INV-001",
        "FIELD-INV-002",
        "FIELD-INV-003",
        "FIELD-INV-004"
      ]
    },
    {
      "domainId": "DOMAIN-NORMALIZE",
      "name": "Normalization",
      "rulePrefix": "NORMALIZE",
      "rules": [
        "NORMALIZE-RULE-001",
        "NORMALIZE-RULE-002",
        "NORMALIZE-RULE-003",
        "NORMALIZE-RULE-004",
        "NORMALIZE-RULE-005",
        "NORMALIZE-RULE-006",
        "NORMALIZE-RULE-007",
        "NORMALIZE-RULE-008",
        "NORMALIZE-RULE-009",
        "NORMALIZE-RULE-010"
      ],
      "invariants": [
        "NORMALIZE-INV-001",
        "NORMALIZE-INV-002",
        "NORMALIZE-INV-003",
        "NORMALIZE-INV-004"
      ]
    },
    {
      "domainId": "DOMAIN-SUBMIT",
      "name": "Entry Submission",
      "rulePrefix": "SUBMIT",
      "rules": [
        "SUBMIT-RULE-001",
        "SUBMIT-RULE-002",
        "SUBMIT-RULE-003",
        "SUBMIT-RULE-004",
        "SUBMIT-RULE-005",
        "SUBMIT-RULE-006",
        "SUBMIT-RULE-007",
        "SUBMIT-RULE-008"
      ],
      "invariants": [
        "SUBMIT-INV-001",
        "SUBMIT-INV-002",
        "SUBMIT-INV-003"
      ]
    },
    {
      "domainId": "DOMAIN-MATCH",
      "name": "Matching",
      "rulePrefix": "MATCH",
      "rules": [
        "MATCH-RULE-001",
        "MATCH-RULE-002",
        "MATCH-RULE-003",
        "MATCH-RULE-004",
        "MATCH-RULE-005",
        "MATCH-RULE-006",
        "MATCH-RULE-007",
        "MATCH-RULE-008",
        "MATCH-RULE-009",
        "MATCH-RULE-010",
        "MATCH-RULE-011",
        "MATCH-RULE-012",
        "MATCH-RULE-013"
      ],
      "invariants": [
        "MATCH-INV-001",
        "MATCH-INV-002",
        "MATCH-INV-003",
        "MATCH-INV-004",
        "MATCH-INV-005"
      ]
    },
    {
      "domainId": "DOMAIN-CANDIDATE",
      "name": "Match Candidate",
      "rulePrefix": "CANDIDATE",
      "rules": [
        "CANDIDATE-RULE-001",
        "CANDIDATE-RULE-002",
        "CANDIDATE-RULE-003",
        "CANDIDATE-RULE-004",
        "CANDIDATE-RULE-005",
        "CANDIDATE-RULE-006",
        "CANDIDATE-RULE-007"
      ],
      "invariants": [
        "CANDIDATE-INV-001",
        "CANDIDATE-INV-002",
        "CANDIDATE-INV-003"
      ]
    },
    {
      "domainId": "DOMAIN-RESOLUTION",
      "name": "Match Resolution",
      "rulePrefix": "RESOLUTION",
      "rules": [
        "RESOLUTION-RULE-001",
        "RESOLUTION-RULE-002",
        "RESOLUTION-RULE-003",
        "RESOLUTION-RULE-004",
        "RESOLUTION-RULE-005",
        "RESOLUTION-RULE-006",
        "RESOLUTION-RULE-007",
        "RESOLUTION-RULE-008",
        "RESOLUTION-RULE-009",
        "RESOLUTION-RULE-010"
      ],
      "invariants": [
        "RESOLUTION-INV-001",
        "RESOLUTION-INV-002",
        "RESOLUTION-INV-003",
        "RESOLUTION-INV-004"
      ]
    },
    {
      "domainId": "DOMAIN-PROMOTION",
      "name": "Canonical Promotion",
      "rulePrefix": "PROMOTION",
      "rules": [
        "PROMOTION-RULE-001",
        "PROMOTION-RULE-002",
        "PROMOTION-RULE-003",
        "PROMOTION-RULE-004",
        "PROMOTION-RULE-005",
        "PROMOTION-RULE-006",
        "PROMOTION-RULE-007",
        "PROMOTION-RULE-008",
        "PROMOTION-RULE-009",
        "PROMOTION-RULE-010",
        "PROMOTION-RULE-011",
        "PROMOTION-RULE-012"
      ],
      "invariants": [
        "PROMOTION-INV-001",
        "PROMOTION-INV-002",
        "PROMOTION-INV-003",
        "PROMOTION-INV-004"
      ]